{
  "schemaVersion": 1,
  "edition": "Java",
  "textureRoot": "assets/minecraft/textures/block",
  "entries": [
    { "key": "dirt", "sourcePath": "assets/minecraft/textures/block/dirt.png" },
    { "key": "grass_block_top", "sourcePath": "assets/minecraft/textures/block/grass_block_top.png" },
    { "key": "mossy_stone_bricks", "sourcePath": "assets/minecraft/textures/block/mossy_stone_bricks.png" },
    { "key": "oak_planks", "sourcePath": "assets/minecraft/textures/block/oak_planks.png" },
    { "key": "dark_oak_planks", "sourcePath": "assets/minecraft/textures/block/dark_oak_planks.png" },
    { "key": "oak_leaves", "sourcePath": "assets/minecraft/textures/block/oak_leaves.png" },
    { "key": "cobblestone", "sourcePath": "assets/minecraft/textures/block/cobblestone.png" },
    { "key": "stone_bricks", "sourcePath": "assets/minecraft/textures/block/stone_bricks.png" },
    { "key": "polished_blackstone_bricks", "sourcePath": "assets/minecraft/textures/block/polished_blackstone_bricks.png" },
    { "key": "nether_bricks", "sourcePath": "assets/minecraft/textures/block/nether_bricks.png" },
    { "key": "netherrack", "sourcePath": "assets/minecraft/textures/block/netherrack.png" },
    { "key": "basalt_top", "sourcePath": "assets/minecraft/textures/block/basalt_top.png" },
    { "key": "water_still", "sourcePath": "assets/minecraft/textures/block/water_still.png" },
    { "key": "magma", "sourcePath": "assets/minecraft/textures/block/magma.png" },
    { "key": "red_sandstone", "sourcePath": "assets/minecraft/textures/block/red_sandstone.png" },
    { "key": "sandstone", "sourcePath": "assets/minecraft/textures/block/sandstone.png" },
    { "key": "cut_sandstone", "sourcePath": "assets/minecraft/textures/block/cut_sandstone.png" },
    { "key": "chiseled_sandstone", "sourcePath": "assets/minecraft/textures/block/chiseled_sandstone.png" },
    { "key": "orange_terracotta", "sourcePath": "assets/minecraft/textures/block/orange_terracotta.png" },
    { "key": "cactus_side", "sourcePath": "assets/minecraft/textures/block/cactus_side.png" },
    { "key": "cactus_top", "sourcePath": "assets/minecraft/textures/block/cactus_top.png" },
    { "key": "packed_ice", "sourcePath": "assets/minecraft/textures/block/packed_ice.png" },
    { "key": "snow_block", "sourcePath": "assets/minecraft/textures/block/snow.png" },
    { "key": "deepslate_bricks", "sourcePath": "assets/minecraft/textures/block/deepslate_bricks.png" },
    { "key": "sculk_sensor_bottom", "sourcePath": "assets/minecraft/textures/block/sculk_sensor_bottom.png" },
    { "key": "sculk_sensor_side", "sourcePath": "assets/minecraft/textures/block/sculk_sensor_side.png" },
    { "key": "sculk_sensor_top", "sourcePath": "assets/minecraft/textures/block/sculk_sensor_top.png" },
    { "key": "sculk_sensor_tendril_inactive", "sourcePath": "assets/minecraft/textures/block/sculk_sensor_tendril_inactive.png" },
    { "key": "prismarine_bricks", "sourcePath": "assets/minecraft/textures/block/prismarine_bricks.png" },
    { "key": "dark_prismarine", "sourcePath": "assets/minecraft/textures/block/dark_prismarine.png" },
    { "key": "sea_lantern", "sourcePath": "assets/minecraft/textures/block/sea_lantern.png" },
    { "key": "tube_coral_block", "sourcePath": "assets/minecraft/textures/block/tube_coral_block.png" },
    { "key": "purpur_block", "sourcePath": "assets/minecraft/textures/block/purpur_block.png" },
    { "key": "obsidian", "sourcePath": "assets/minecraft/textures/block/obsidian.png" },
    { "key": "oak_log", "sourcePath": "assets/minecraft/textures/block/oak_log.png" },
    { "key": "gravel", "sourcePath": "assets/minecraft/textures/block/gravel.png" },
    { "key": "glowstone", "sourcePath": "assets/minecraft/textures/block/glowstone.png" },
    { "key": "bedrock", "sourcePath": "assets/minecraft/textures/block/bedrock.png" },
    { "key": "respawn_anchor_side1", "sourcePath": "assets/minecraft/textures/block/respawn_anchor_side1.png" },
    { "key": "respawn_anchor_top", "sourcePath": "assets/minecraft/textures/block/respawn_anchor_top.png" }
  ]
}
